{
  "$schema": "https://json-schema.org/draft/2020-12/schema",
  "$id": "https://ontology-dashboard.local/schemas/generator-dataset-input-manifest.schema.json",
  "title": "Generator Dataset Input Manifest v1",
  "type": "object",
  "additionalProperties": false,
  "required": [
    "manifest_version",
    "dataset_type",
    "dataset_id",
    "dataset_version",
    "schema_version",
    "created_at",
    "files"
  ],
  "properties": {
    "manifest_version": {
      "type": "string",
      "const": "generator-dataset-input-v1"
    },
    "dataset_type": {
      "type": "string",
      "enum": [
        "observation",
        "failure"
      ]
    },
    "dataset_id": {
      "type": "string",
      "pattern": "^[A-Za-z0-9][A-Za-z0-9._-]{0,159}$"
    },
    "dataset_version": {
      "type": "string",
      "pattern": "^[A-Za-z0-9][A-Za-z0-9._-]{0,159}$"
    },
    "schema_version": {
      "type": "string",
      "pattern": "^[A-Za-z0-9][A-Za-z0-9._-]{0,159}$"
    },
    "created_at": {
      "type": "string",
      "format": "date-time"
    },
    "files": {
      "type": "array",
      "minItems": 1,
      "items": {
        "type": "object",
        "additionalProperties": false,
        "required": [
          "role",
          "path",
          "media_type",
          "sha256",
          "size_bytes"
        ],
        "properties": {
          "role": {
            "type": "string",
            "enum": [
              "observations",
              "failures"
            ]
          },
          "path": {
            "type": "string",
            "pattern": "^(?!/)(?!.*\\.\\.)[A-Za-z0-9._/-]+$"
          },
          "media_type": {
            "type": "string",
            "enum": [
              "text/csv",
              "application/x-ndjson",
              "application/jsonl"
            ]
          },
          "sha256": {
            "type": "string",
            "pattern": "^[a-f0-9]{64}$"
          },
          "size_bytes": {
            "type": "integer",
            "minimum": 1
          }
        }
      }
    },
    "auxiliary_files": {
      "type": "array",
      "items": {
        "type": "object",
        "additionalProperties": false,
        "required": [
          "role",
          "path",
          "media_type",
          "sha256",
          "size_bytes"
        ],
        "properties": {
          "role": {
            "type": "string",
            "enum": [
              "provenance",
              "rejected"
            ]
          },
          "path": {
            "type": "string",
            "pattern": "^(?!/)(?!.*\\.\\.)[A-Za-z0-9._/-]+$"
          },
          "media_type": {
            "type": "string",
            "enum": [
              "text/csv",
              "application/x-ndjson",
              "application/jsonl"
            ]
          },
          "sha256": {
            "type": "string",
            "pattern": "^[a-f0-9]{64}$"
          },
          "size_bytes": {
            "type": "integer",
            "minimum": 0
          }
        }
      }
    }
  }
}
